{
  "$schema": "https://json-schema.org/draft/2020-12/schema",
  "$id": "https://example.local/schemas/ibm-bob-detail-design-v2.schema.json",
  "title": "IBM-Bob Detail Design Structured File",
  "type": "object",
  "required": [
    "schema_version",
    "document_control",
    "source_basic_design",
    "feature",
    "traceability",
    "impact_analysis",
    "source_changes",
    "modules",
    "data_design",
    "shared_memory_globals",
    "thread_design",
    "rt_design",
    "ts_design",
    "function_specs",
    "concurrency",
    "error_safety",
    "performance_budget",
    "test_handoff",
    "build_test_static_analysis",
    "open_issues"
  ],
  "properties": {
    "schema_version": {
      "type": "string",
      "const": "ibm-bob-detail-design/2.0"
    },
    "review_status": {
      "type": "string",
      "enum": [
        "draft",
        "pre_reviewed",
        "human_reviewed",
        "approved"
      ]
    },
    "document_control": {
      "type": "object",
      "required": [
        "document_id",
        "title",
        "target_system",
        "target_version",
        "created_at",
        "author"
      ],
      "properties": {
        "document_id": {
          "type": "string"
        },
        "title": {
          "type": "string"
        },
        "target_system": {
          "type": "string"
        },
        "target_version": {
          "type": "string"
        },
        "created_at": {
          "type": "string"
        },
        "author": {
          "type": "string"
        },
        "reviewer": {
          "type": "string"
        },
        "approver": {
          "type": "string"
        },
        "revision_history": {
          "type": "array",
          "items": {
            "type": "object",
            "additionalProperties": true
          }
        }
      },
      "additionalProperties": true
    },
    "source_basic_design": {
      "type": "object",
      "required": [
        "basic_design_id",
        "title",
        "version"
      ],
      "properties": {
        "basic_design_id": {
          "type": "string"
        },
        "title": {
          "type": "string"
        },
        "version": {
          "type": "string"
        },
        "source_json_path": {
          "type": "string"
        },
        "source_docx_path": {
          "type": "string"
        },
        "accepted_warnings": {
          "type": "array",
          "items": {
            "type": "string"
          }
        }
      },
      "additionalProperties": true
    },
    "feature": {
      "type": "object",
      "required": [
        "feature_id",
        "name",
        "summary"
      ],
      "properties": {
        "feature_id": {
          "type": "string"
        },
        "name": {
          "type": "string"
        },
        "summary": {
          "type": "string"
        },
        "classification": {
          "type": "object",
          "additionalProperties": true
        },
        "estimated_new_steps": {
          "type": "string"
        }
      },
      "additionalProperties": true
    },
    "introduction": {
      "type": "object",
      "additionalProperties": true
    },
    "automation_policy": {
      "type": "object",
      "additionalProperties": true
    },
    "section_map": {
      "type": "array",
      "items": {
        "type": "object",
        "additionalProperties": true
      }
    },
    "traceability": {
      "type": "object",
      "properties": {
        "requirements": {
          "type": "array",
          "items": {
            "type": "object",
            "additionalProperties": true
          }
        },
        "matrix": {
          "type": "array",
          "items": {
            "type": "object",
            "additionalProperties": true
          }
        },
        "basic_sections": {
          "type": "array",
          "items": {
            "type": "object",
            "additionalProperties": true
          }
        }
      },
      "additionalProperties": true
    },
    "impact_analysis": {
      "type": "object",
      "properties": {
        "items": {
          "type": "array",
          "items": {
            "type": "object",
            "required": [
              "id",
              "target_type",
              "target",
              "impact",
              "change_policy"
            ],
            "properties": {
              "id": {
                "type": "string"
              },
              "target_type": {
                "type": "string"
              },
              "target": {
                "type": "string"
              },
              "impact": {
                "type": "string",
                "enum": [
                  "あり",
                  "なし",
                  "要確認",
                  "N/A"
                ]
              },
              "change_policy": {
                "type": "string"
              },
              "evidence": {
                "type": "string"
              }
            },
            "additionalProperties": true
          }
        }
      },
      "additionalProperties": true
    },
    "source_changes": {
      "type": "object",
      "properties": {
        "files": {
          "type": "array",
          "items": {
            "type": "object",
            "required": [
              "id",
              "path",
              "change_type",
              "summary"
            ],
            "properties": {
              "id": {
                "type": "string"
              },
              "path": {
                "type": "string"
              },
              "change_type": {
                "type": "string",
                "enum": [
                  "追加",
                  "変更",
                  "削除",
                  "参照のみ"
                ]
              },
              "summary": {
                "type": "string"
              },
              "depends_on": {
                "type": "array",
                "items": {
                  "type": "string"
                }
              },
              "review_focus": {
                "type": "string"
              }
            },
            "additionalProperties": true
          }
        }
      },
      "additionalProperties": true
    },
    "modules": {
      "type": "array",
      "items": {
        "type": "object",
        "required": [
          "id",
          "name",
          "file",
          "responsibility",
          "execution_context"
        ],
        "properties": {
          "id": {
            "type": "string"
          },
          "name": {
            "type": "string"
          },
          "file": {
            "type": "string"
          },
          "responsibility": {
            "type": "string"
          },
          "callers": {
            "type": "array",
            "items": {
              "type": "string"
            }
          },
          "callees": {
            "type": "array",
            "items": {
              "type": "string"
            }
          },
          "execution_context": {
            "type": "string",
            "enum": [
              "RT_INPUT",
              "RT_CONTROL",
              "RT_OUTPUT",
              "TS_SERVICE",
              "API",
              "COMMON",
              "TEST"
            ]
          }
        },
        "additionalProperties": true
      }
    },
    "data_design": {
      "type": "object",
      "properties": {
        "items": {
          "type": "array",
          "items": {
            "type": "object",
            "additionalProperties": true
          }
        },
        "structs": {
          "type": "array",
          "items": {
            "type": "object",
            "additionalProperties": true
          }
        },
        "enums": {
          "type": "array",
          "items": {
            "type": "object",
            "additionalProperties": true
          }
        },
        "constants": {
          "type": "array",
          "items": {
            "type": "object",
            "additionalProperties": true
          }
        }
      },
      "additionalProperties": true
    },
    "shared_memory_globals": {
      "type": "array",
      "items": {
        "type": "object",
        "required": [
          "id",
          "name",
          "type",
          "owner",
          "writers",
          "readers",
          "consistency_policy"
        ],
        "properties": {
          "id": {
            "type": "string"
          },
          "name": {
            "type": "string"
          },
          "type": {
            "type": "string"
          },
          "defined_in": {
            "type": "string"
          },
          "owner": {
            "type": "string"
          },
          "writers": {
            "type": "array",
            "items": {
              "type": "string"
            }
          },
          "readers": {
            "type": "array",
            "items": {
              "type": "string"
            }
          },
          "update_cycle": {
            "type": "string"
          },
          "consistency_policy": {
            "type": "string"
          },
          "initial_value": {
            "type": "string"
          },
          "reset_policy": {
            "type": "string"
          },
          "public_header_impact": {
            "type": "string"
          }
        },
        "additionalProperties": true
      }
    },
    "api_design": {
      "type": "object",
      "properties": {
        "applicable": {
          "type": "boolean"
        },
        "apis": {
          "type": "array",
          "items": {
            "type": "object",
            "additionalProperties": true
          }
        },
        "compatibility_policy": {
          "type": "string"
        }
      },
      "additionalProperties": true
    },
    "thread_design": {
      "type": "object",
      "properties": {
        "tasks": {
          "type": "array",
          "items": {
            "type": "object",
            "additionalProperties": true
          }
        },
        "rt_budget_policy": {
          "type": "string"
        },
        "ts_slice_policy": {
          "type": "string"
        }
      },
      "additionalProperties": true
    },
    "rt_design": {
      "type": "object",
      "properties": {
        "steps": {
          "type": "array",
          "items": {
            "type": "object",
            "additionalProperties": true
          }
        },
        "prohibited_operations": {
          "type": "array",
          "items": {
            "type": "string"
          }
        },
        "fallback_policy": {
          "type": "string"
        }
      },
      "additionalProperties": true
    },
    "ts_design": {
      "type": "object",
      "properties": {
        "steps": {
          "type": "array",
          "items": {
            "type": "object",
            "additionalProperties": true
          }
        },
        "io_policy": {
          "type": "string"
        },
        "interruption_policy": {
          "type": "string"
        }
      },
      "additionalProperties": true
    },
    "function_specs": {
      "type": "array",
      "items": {
        "type": "object",
        "required": [
          "id",
          "name",
          "file",
          "callers",
          "inputs",
          "outputs",
          "return_value",
          "side_effects",
          "error_conditions"
        ],
        "properties": {
          "id": {
            "type": "string"
          },
          "name": {
            "type": "string"
          },
          "file": {
            "type": "string"
          },
          "callers": {
            "type": "array",
            "items": {
              "type": "string"
            }
          },
          "inputs": {
            "type": "array",
            "items": {
              "type": "object",
              "additionalProperties": true
            }
          },
          "outputs": {
            "type": "array",
            "items": {
              "type": "object",
              "additionalProperties": true
            }
          },
          "return_value": {
            "type": "string"
          },
          "side_effects": {
            "type": "array",
            "items": {
              "type": "string"
            }
          },
          "error_conditions": {
            "type": "array",
            "items": {
              "type": "object",
              "additionalProperties": true
            }
          },
          "pseudo_code": {
            "type": "array",
            "items": {
              "type": "string"
            }
          },
          "unit_test_viewpoints": {
            "type": "array",
            "items": {
              "type": "string"
            }
          }
        },
        "additionalProperties": true
      }
    },
    "state_machines": {
      "type": "array",
      "items": {
        "type": "object",
        "additionalProperties": true
      }
    },
    "sequences": {
      "type": "array",
      "items": {
        "type": "object",
        "additionalProperties": true
      }
    },
    "concurrency": {
      "type": "object",
      "properties": {
        "items": {
          "type": "array",
          "items": {
            "type": "object",
            "additionalProperties": true
          }
        },
        "lock_order": {
          "type": "array",
          "items": {
            "type": "string"
          }
        },
        "memory_visibility_policy": {
          "type": "string"
        },
        "multi_request_policy": {
          "type": "string"
        }
      },
      "additionalProperties": true
    },
    "error_safety": {
      "type": "object",
      "properties": {
        "errors": {
          "type": "array",
          "items": {
            "type": "object",
            "additionalProperties": true
          }
        },
        "fail_safe_policy": {
          "type": "string"
        },
        "recovery_policy": {
          "type": "string"
        }
      },
      "additionalProperties": true
    },
    "logging_diagnostics": {
      "type": "object",
      "properties": {
        "logs": {
          "type": "array",
          "items": {
            "type": "object",
            "additionalProperties": true
          }
        },
        "diagnostic_snapshots": {
          "type": "array",
          "items": {
            "type": "object",
            "additionalProperties": true
          }
        },
        "throttle_policy": {
          "type": "string"
        }
      },
      "additionalProperties": true
    },
    "parameters": {
      "type": "array",
      "items": {
        "type": "object",
        "additionalProperties": true
      }
    },
    "performance_budget": {
      "type": "object",
      "properties": {
        "items": {
          "type": "array",
          "items": {
            "type": "object",
            "additionalProperties": true
          }
        },
        "rt_total_budget": {
          "type": "string"
        },
        "measurement_method": {
          "type": "string"
        }
      },
      "additionalProperties": true
    },
    "initialization_reset": {
      "type": "object",
      "properties": {
        "items": {
          "type": "array",
          "items": {
            "type": "object",
            "additionalProperties": true
          }
        },
        "compatibility_policy": {
          "type": "string"
        }
      },
      "additionalProperties": true
    },
    "test_handoff": {
      "type": "object",
      "properties": {
        "viewpoints": {
          "type": "array",
          "items": {
            "type": "object",
            "additionalProperties": true
          }
        },
        "acceptance_criteria": {
          "type": "array",
          "items": {
            "type": "object",
            "additionalProperties": true
          }
        },
        "test_data": {
          "type": "array",
          "items": {
            "type": "object",
            "additionalProperties": true
          }
        }
      },
      "additionalProperties": true
    },
    "build_test_static_analysis": {
      "type": "object",
      "properties": {
        "vc2026": {
          "type": "object",
          "additionalProperties": true
        },
        "clang_windows": {
          "type": "object",
          "additionalProperties": true
        },
        "static_analysis": {
          "type": "object",
          "additionalProperties": true
        },
        "workspace_profiles": {
          "type": "array",
          "items": {
            "type": "object",
            "additionalProperties": true
          }
        }
      },
      "additionalProperties": true
    },
    "open_issues": {
      "type": "array",
      "items": {
        "type": "object",
        "additionalProperties": true
      }
    },
    "ai_review": {
      "type": "object",
      "properties": {
        "summary": {
          "type": "object",
          "additionalProperties": true
        },
        "results": {
          "type": "array",
          "items": {
            "type": "object",
            "additionalProperties": true
          }
        },
        "overall_judgement": {
          "type": "string"
        }
      },
      "additionalProperties": true
    },
    "appendix": {
      "type": "object",
      "additionalProperties": true
    }
  }
}