{
  "schema_version": "ibm-bob-detail-design/2.0",
  "review_status": "draft",
  "document_control": {
    "document_id": "DD-209",
    "title": "G88手動戻りボーリングサイクル機能 詳細設計書",
    "target_system": "IBM-Bob baseline / Windows C realtime-control platform",
    "target_version": "Ver.1.0",
    "created_at": "2026-04-29",
    "author": "AIドラフト",
    "reviewer": "",
    "approver": "",
    "revision_history": [
      {
        "version": "0.1",
        "date": "2026-04-29",
        "change": "初版作成",
        "author": "AIドラフト",
        "review_status": "draft"
      }
    ]
  },
  "source_basic_design": {
    "basic_design_id": "BD-209",
    "title": "G88手動戻りボーリングサイクル機能 基本設計書",
    "version": "0.1",
    "source_json_path": "G88手動戻りボーリングサイクル機能_基本設計書.json",
    "source_docx_path": "G88手動戻りボーリングサイクル機能_基本設計書.docx",
    "accepted_warnings": []
  },
  "feature": {
    "feature_id": "FX-BD-209",
    "name": "G88手動戻りボーリングサイクル機能",
    "summary": "穴底まで加工後に一時停止し、オペレータが手動で工具を引き抜いてから再開する。",
    "classification": {
      "realtime_control": true,
      "time_share_processing": true,
      "api_change": true,
      "global_variable_change": true,
      "state_machine": true,
      "sequence_control": true
    },
    "estimated_new_steps": "300-900 step"
  },
  "introduction": {
    "purpose": "G88手動戻りボーリングサイクル機能の基本設計を、IBM-Bob基盤上で実装可能なモジュール、データ構造、RT/TS/API処理、状態遷移、異常安全へ展開する。",
    "scope": "G88 X Y Z R P F、オペレータ再開信号、G80 を対象に、NCプログラム/MDI/APIからの要求をRT制御で実行する範囲。",
    "out_of_scope": "サーボドライブ内部制御、機械メーカー固有PMC詳細、最終加工条件の決定。",
    "assumptions": [
      "Windows C基盤",
      "RT/TS分離",
      "共有メモリ固定長構造体",
      "RT内ファイルI/O禁止"
    ],
    "design_granularity_policy": "関数・構造体・処理順序まで具体化するが、ソースコード全文は記載しない。"
  },
  "automation_policy": {
    "generation_source": "basic_design_json_or_docx",
    "roundtrip_policy": "SECTION_ID and JSON Path based extraction",
    "pre_review_checklist": "ibm_bob_detail_design_pre_review_checklist.json"
  },
  "section_map": [
    {
      "section_id": "DD-01",
      "title": "はじめに",
      "json_path": "$.introduction",
      "required": "必須",
      "focus": "目的・適用範囲・対象外"
    },
    {
      "section_id": "DD-02",
      "title": "入力文書・トレーサビリティ",
      "json_path": "$.traceability",
      "required": "必須",
      "focus": "基本設計/要件/機能IDの対応"
    },
    {
      "section_id": "DD-03",
      "title": "既存仕様・コード影響調査",
      "json_path": "$.impact_analysis",
      "required": "必須",
      "focus": "既存仕様書/ヘッダ/ソース/テスト影響"
    },
    {
      "section_id": "DD-04",
      "title": "ソース構成・変更対象ファイル",
      "json_path": "$.source_changes",
      "required": "必須",
      "focus": "include/src/test/scriptsの変更"
    },
    {
      "section_id": "DD-05",
      "title": "モジュール構造設計",
      "json_path": "$.modules",
      "required": "必須",
      "focus": "責務分割・依存関係"
    },
    {
      "section_id": "DD-06",
      "title": "データ構造・型定義設計",
      "json_path": "$.data_design",
      "required": "必須",
      "focus": "enum/struct/定数"
    },
    {
      "section_id": "DD-07",
      "title": "グローバル変数・共有メモリ設計",
      "json_path": "$.shared_memory_globals",
      "required": "必須",
      "focus": "所有者/読取元/書込元"
    },
    {
      "section_id": "DD-08",
      "title": "API・公開ヘッダ設計",
      "json_path": "$.api_design",
      "required": "条件必須",
      "focus": "API追加/変更時必須"
    },
    {
      "section_id": "DD-09",
      "title": "スレッド配置・周期設計",
      "json_path": "$.thread_design",
      "required": "必須",
      "focus": "RT/TS/API処理配置"
    },
    {
      "section_id": "DD-10",
      "title": "リアルタイム処理詳細",
      "json_path": "$.rt_design",
      "required": "必須",
      "focus": "周期内処理・禁止事項"
    },
    {
      "section_id": "DD-11",
      "title": "タイムシェア処理詳細",
      "json_path": "$.ts_design",
      "required": "必須",
      "focus": "I/O・重計算・ログ"
    },
    {
      "section_id": "DD-12",
      "title": "関数詳細仕様",
      "json_path": "$.function_specs",
      "required": "必須",
      "focus": "関数単位IPO・擬似コード"
    },
    {
      "section_id": "DD-13",
      "title": "状態遷移設計",
      "json_path": "$.state_machines",
      "required": "条件必須",
      "focus": "状態管理がある場合必須"
    },
    {
      "section_id": "DD-14",
      "title": "シーケンス/ハンドシェイク設計",
      "json_path": "$.sequences",
      "required": "条件必須",
      "focus": "逐次応答・外部機器応答待ち"
    },
    {
      "section_id": "DD-15",
      "title": "排他・整合性・メモリ可視性",
      "json_path": "$.concurrency",
      "required": "必須",
      "focus": "request/busy/ready/generation等"
    },
    {
      "section_id": "DD-16",
      "title": "エラー・フェイルセーフ設計",
      "json_path": "$.error_safety",
      "required": "必須",
      "focus": "安全側出力・復帰"
    },
    {
      "section_id": "DD-17",
      "title": "ログ・診断設計",
      "json_path": "$.logging_diagnostics",
      "required": "必須",
      "focus": "ログ/スナップショット/CSV"
    },
    {
      "section_id": "DD-18",
      "title": "パラメータ・設定設計",
      "json_path": "$.parameters",
      "required": "任意",
      "focus": "設定値・範囲・初期値"
    },
    {
      "section_id": "DD-19",
      "title": "性能・リアルタイム予算",
      "json_path": "$.performance_budget",
      "required": "必須",
      "focus": "RT追加時間・TS負荷"
    },
    {
      "section_id": "DD-20",
      "title": "初期化・リセット・移行",
      "json_path": "$.initialization_reset",
      "required": "必須",
      "focus": "初期値/クリア条件/互換"
    },
    {
      "section_id": "DD-21",
      "title": "テスト設計への引継ぎ",
      "json_path": "$.test_handoff",
      "required": "必須",
      "focus": "単体/統合/性能/異常系"
    },
    {
      "section_id": "DD-22",
      "title": "ビルド・テスト・静的解析",
      "json_path": "$.build_test_static_analysis",
      "required": "必須",
      "focus": "VC2026/clang/CI"
    },
    {
      "section_id": "DD-23",
      "title": "未確定事項・リスク",
      "json_path": "$.open_issues",
      "required": "必須",
      "focus": "要判断事項"
    },
    {
      "section_id": "DD-24",
      "title": "AIプレレビュー結果",
      "json_path": "$.ai_review",
      "required": "任意",
      "focus": "レビュー結果格納"
    }
  ],
  "traceability": {
    "requirements": [
      {
        "id": "REQ-001",
        "summary": "有効指令を実行できること",
        "basic_design_section_ids": [
          "BD-07",
          "BD-13",
          "BD-15"
        ],
        "detail_design_section_ids": [
          "DD-09",
          "DD-10",
          "DD-16"
        ]
      },
      {
        "id": "REQ-002",
        "summary": "不正指令を拒否できること",
        "basic_design_section_ids": [
          "BD-07",
          "BD-13",
          "BD-15"
        ],
        "detail_design_section_ids": [
          "DD-09",
          "DD-10",
          "DD-16"
        ]
      },
      {
        "id": "REQ-003",
        "summary": "異常時は安全側へ遷移すること",
        "basic_design_section_ids": [
          "BD-07",
          "BD-13",
          "BD-15"
        ],
        "detail_design_section_ids": [
          "DD-09",
          "DD-10",
          "DD-16"
        ]
      }
    ],
    "matrix": [
      {
        "requirement_id": "REQ-001",
        "basic_section_id": "BD-07",
        "detail_section_id": "DD-12",
        "implementation_targets": [
          "FUNC-009-01",
          "FUNC-009-03"
        ],
        "test_viewpoints": [
          "TV-009-01",
          "TV-009-02"
        ]
      },
      {
        "requirement_id": "REQ-002",
        "basic_section_id": "BD-07",
        "detail_section_id": "DD-12",
        "implementation_targets": [
          "FUNC-009-01",
          "FUNC-009-03"
        ],
        "test_viewpoints": [
          "TV-009-01",
          "TV-009-02"
        ]
      },
      {
        "requirement_id": "REQ-003",
        "basic_section_id": "BD-07",
        "detail_section_id": "DD-12",
        "implementation_targets": [
          "FUNC-009-01",
          "FUNC-009-03"
        ],
        "test_viewpoints": [
          "TV-009-01",
          "TV-009-02"
        ]
      }
    ],
    "basic_sections": [
      {
        "section_id": "BD-06",
        "title": "基本設計参照章"
      },
      {
        "section_id": "BD-07",
        "title": "基本設計参照章"
      },
      {
        "section_id": "BD-09",
        "title": "基本設計参照章"
      },
      {
        "section_id": "BD-10",
        "title": "基本設計参照章"
      },
      {
        "section_id": "BD-11",
        "title": "基本設計参照章"
      },
      {
        "section_id": "BD-13",
        "title": "基本設計参照章"
      },
      {
        "section_id": "BD-14",
        "title": "基本設計参照章"
      },
      {
        "section_id": "BD-15",
        "title": "基本設計参照章"
      },
      {
        "section_id": "BD-18",
        "title": "基本設計参照章"
      },
      {
        "section_id": "BD-19",
        "title": "基本設計参照章"
      }
    ]
  },
  "impact_analysis": {
    "items": [
      {
        "id": "IMP-009-01",
        "target_type": "ヘッダ",
        "target": "include/system_shared.h",
        "impact": "あり",
        "change_policy": "G88MAN_COMMAND/STATUS/PARAMとextern宣言を追加",
        "evidence": "共有メモリ追加が必要"
      },
      {
        "id": "IMP-009-02",
        "target_type": "ヘッダ",
        "target": "include/control_api.h",
        "impact": "あり",
        "change_policy": "Api_GetG88ManualReturnBoringStatus等の状態取得APIを追加",
        "evidence": "外部UI/テストから状態確認が必要"
      },
      {
        "id": "IMP-009-03",
        "target_type": "ソース",
        "target": "src/rt_control.c",
        "impact": "あり",
        "change_policy": "G88ManualReturnBoring_ApplyRtをRT_CONTROLに組み込み",
        "evidence": "周期処理で状態・出力更新を行う"
      },
      {
        "id": "IMP-009-04",
        "target_type": "ソース",
        "target": "src/ts_service.c",
        "impact": "あり",
        "change_policy": "G88ManualReturnBoring_ParseBlockTs/BuildPlanTsをTS側に組み込み",
        "evidence": "NC解釈/重計算はTS側"
      },
      {
        "id": "IMP-009-05",
        "target_type": "テスト",
        "target": "tests/feature",
        "impact": "あり",
        "change_policy": "単体/統合/性能/異常系テストを追加",
        "evidence": "RT周期と安全動作の検証が必要"
      },
      {
        "id": "IMP-009-06",
        "target_type": "ビルド",
        "target": "scripts/build_vc2026.bat, scripts/build_clang.bat",
        "impact": "あり",